[
  {
    "claim_id": "CLAIM-VT-002",
    "related_task": "TASK-VT-015",
    "code_refs": [
      "src/vibe_tracing/commands/accept.py",
      "src/vibe_tracing/merge_gate_engine.py",
      "src/vibe_tracing/architecture_change_proposal.py",
      "src/vibe_tracing/schemas/architecture_constraints.schema.json",
      "src/vibe_tracing/templates/architecture_constraints.template.json",
      "docs/architecture_constraints.json"
    ],
    "test_refs": [
      "tests/test_cli_analyze.py",
      "tests/test_merge_gate_engine.py"
    ],
    "notes": "Phase 1 补齐：accept 重写、MergeGate accepted_rule、proposals 填充、schema 清理",
    "content_hash": "919273954fbc8b67"
  },
  {
    "claim_id": "CLAIM-VT-003",
    "related_task": "TASK-VT-066",
    "code_refs": [
      "src/vibe_tracing/operational_logger.py",
      "src/vibe_tracing/commands/analyze/pipeline.py",
      "src/vibe_tracing/commands/analyze/analysis.py",
      "src/vibe_tracing/tool_evidence_adapter.py",
      "src/vibe_tracing/evidence_index_builder.py",
      "src/vibe_tracing/hint_loader.py",
      "src/vibe_tracing/git_utils.py",
      "src/vibe_tracing/ghost_code_reconciler.py",
      "src/vibe_tracing/merge_gate_engine.py",
      "src/vibe_tracing/architecture_compliance_checker.py",
      "src/vibe_tracing/traceability/ac_test_analyzer.py",
      "src/vibe_tracing/traceability/claim_evidence_analyzer.py",
      "src/vibe_tracing/traceability/requirement_task_analyzer.py",
      "docs/architecture_constraints.json"
    ],
    "test_refs": [
      "tests/test_operational_logger.py",
      "tests/test_timing_instrumentation.py",
      "tests/test_exception_logging.py",
      "tests/test_instrumentation_logging.py",
      "tests/test_tool_execution.py"
    ],
    "notes": "运行时日志系统：JSON Lines 日志器 + pipeline 计时 + 子进程计时 + 异常记录 + 缓存/hint/DEBUG 插桩",
    "content_hash": "2f981731a6543c20"
  }
]
