[
  {
    "claim_id": "CLAIM-VT-001",
    "related_task": "TASK-VT-015",
    "code_refs": [
      "src/vibe_tracing/architecture_compliance_checker.py",
      "src/vibe_tracing/commands/accept.py",
      "src/vibe_tracing/merge_gate_engine.py",
      "src/vibe_tracing/architecture_change_proposal.py",
      "src/vibe_tracing/context.py",
      "src/vibe_tracing/commands/analyze/analysis.py",
      "src/vibe_tracing/commands/analyze/pipeline.py",
      "src/vibe_tracing/commands/analyze/reports.py",
      "src/vibe_tracing/evidence_index_builder.py",
      "src/vibe_tracing/commands/analyze/formatting.py",
      "src/vibe_tracing/commands/analyze/output.py",
      "src/vibe_tracing/commands/analyze/actions.py",
      "src/vibe_tracing/dashboard_renderer.py",
      "src/vibe_tracing/reflection_prompts.py",
      "src/vibe_tracing/governance.py",
      "src/vibe_tracing/risk_advisor.py",
      "src/vibe_tracing/cli.py",
      "src/vibe_tracing/scripts/migrate_accepted_rules.py"
    ],
    "test_refs": [
      "tests/test_merge_gate_engine.py",
      "tests/test_architecture_compliance_checker.py",
      "tests/test_analyze_refactor_integration.py",
      "tests/test_unified_context.py",
      "tests/test_cli_analyze.py",
      "tests/test_e2e_samples.py",
      "tests/test_integration_v3.py",
      "tests/test_self_governance.py"
    ],
    "notes": "设计基线净化 + analyze 阶段架构级重构：accept 重写、compliance checker 接入 human_decisions、MergeGate 识别 accepted_rule、proposals 填充、27 个 analyze 问题修复、TypedContext。904 测试通过。",
    "content_hash": "a3ca5c23b8a8159d"
  }
]
